{
  "event_id": "msg:771",
  "type": "comment",
  "author": {
    "partner_id": 1201,
    "email": "maria.santos@company.com",
    "name": "Maria Santos"
  },
  "body_md": "Please confirm totals by EOD @juan.cruz@company.com",
  "mentions": [
    {
      "email": "juan.cruz@company.com",
      "partner_id": 1202
    }
  ],
  "created_at": "2025-12-15T10:20:00+08:00"
}
